,title,description,title_label,description_label
433, 이재명 사법리스크 현실화에 당황한 전략 대전환 고심 , 공격이 최고의 방어 라는 기조 아래 민주당은 당분간 윤석열 대통령과 김건희 여사에 대한 퇴진 촉구 등 또한 민주당은 일 저녁 시부터 국회 본관 앞 계단에서 김건희 특검법 관철 민주당 국회의원 차 비상행동 ,0,1
434, 모두 리더십 위기 국민은 기댈 데 가 없다,더불어민주당 이재명 대표의 사법 리스크 가 현실화하면서 여야 지지층이 총결집하고 있다 하지만 여야 당대표는 물론 대통령까지 갖가지 리스크에 휘말리면서 누구도 강력한 리더십을 발휘하기 어려운 상황이다 이런 ,0,1
435, 이재명 리스크 에 요동치는 정치권 여야 적대적 공생관계 균열,국민의힘은 강력한 호재를 만났지만 이 대표를 향한 공세를 강화할수록 윤 대통령과 김건희 여사 리스크가 더 부각되는 역효과를 감수해야 한다 단일대오 민주당 일 선고가 관건 민주당은 일단 단일대오 에 ,0,0
436, 뉴스룸에서 명태균의 기념사진,최근 김건희 여사 공천 개입 의혹이 일파만파다 의혹의 핵심 인물인 명태균 씨는 지난 월 김건희 여사의 김영선 전 의원 공천 개입 의혹 과정에서 드러났다 명씨는 평소 주변에 윤 대통령 부부와의 친분을 ,1,1
437,명태균 소개한 자리에 공천 대가 돈 건넨 예비후보 명도 있었다,김태열 전 미래한국연구소장은 에 명태균이 공천 시점에 김건희 여사 소개시켜 준다고 데리고 아크로비스타까지 갔어요 근데 가서 만나지를 못했어요 라며 이들 중 한 명을 윤 대통령 부부 자택에 데리고 갔다고 ,0,0
438, 일 선고도 선거법 같은 결과 나올것 이재명 리스크 총공세,국민의힘은 민주당의 김건희 특검법 이탈표 압박과 탄핵 임기 단축 공세 등을 막는 데 급급했던 상황을 것 이라며 이 대표는 사법처리 됐는데 왜 김건희 여사는 수사하지 않느냐는 여론이 생길 수 있다 고 했다 ,0,1
439,이재명 심 유죄 다음날 결코 죽지 않는다 ,더불어민주당 이재명 대표가 일 저녁 서울 광화문 일대에서 민주당 주최로 열린 김건희 윤석열 국정농단 규탄 및 특검 촉구 차 집회에 참석해 이재명은 결코 죽지 않는다 고 말했다 공직선거법 위반 심에서 ,1,1
440, 사법부 겁박 법치주의 근간 흔들어 이재명 재판 무관한 ,민주당 한민수 대변인은 판사 겁박 이란 지적에 광화문 일대 장외집회는 이 대표의 재판 결과와 무관하게 예정돼 있던 윤석열 김건희 국정농단 규탄 및 특검 촉구 집회 라며 어떻게 이 장외집회가 판사 ,0,1
441, 단독 명태균 창원산단관련 시장과 회동 대외비 문건 보고받은 사실 ,검찰은 명 씨가 대선에서 윤 대통령을 지원한 대가로 김건희 여사를 통해 창원 국가산단 선정에 개입하게 민주당 안귀령 대변인은 검찰이 변죽만 울리지 말고 김건희 여사를 수사하라 고 촉구했다 ,1,0
442, 사설 인권 최후보루 칭송하더니 사법부 압박 멈춰야,민주당이 주말에 서울 광화문에서 개최한 김건희 윤석열 규탄 집회에선 재판부에 대한 불만이 노골적으로 터져나왔다 특히 박찬대 원내대표는 미친 정권의 미친 판결이고 검찰독재 정권의 정적 제거에 부역하는 ,0,1
443, 속보 대통령 페루 마치고 브라질로 출발,부인 김건희 여사가 이번 순방에 동행하지 않은 가운데 윤 대통령은 정상회의가 열리는 브라질 리우데자네이루에 도착 이후 일 브라질이 중점 성과로 추진 중인 글로벌 기아 빈곤 퇴치 연합 출범식에 ,1,0
444, 이하경 칼럼 윤 대통령에게 골프 연습보다 더 중요한 것,구속된 정치브로커 명태균씨와 얽힌 김건희 여사 공천 개입 의혹은 좋은 사냥감이 될 것이다 대통령실은 대선 경선 이후 대통령은 명씨와 문자를 주고받거나 통화한 사실이 없다 고 했다 하지만 대통령 취임식 전날 ,0,1
445,민주 오늘 김 여사 특검법 관철 차 비상행동 선포식, 월을 김건희 여사 특검의 달 로 규정한 더불어민주당이 특검법 관철을 위한 차 비상행동에 나섭니다 더불어민주당은 오늘 일 오후 시 국회 본관 계단에서 김건희 특검법 관철 민주당 국회의원 차 비상행동 선포식 ,0,0
446, 김여사 문제 어물쩍 넘어가선 안돼 회견 때 했던 약속 지켜야 ,윤석열 대통령이 지난 일 대국민 담화와 기자회견에서 제시한 김건희 여사 리스크 해소 방안과 인적 쇄신 김 의원은 우리가 민생을 얘기하고 인적 쇄신을 잘하더라도 김건희 여사 문제를 해결하지 못한다면 국민이 ,0,1
447, 여권 쇄신 지금이 골든타임 ,오히려 지금이 쇄신에 나서야 할 골든타임 이라며 윤석열 대통령이 약속한 김건희 여사 리스크 해소 등 쇄신 조치를 착실히 이행해나가야 한다고 했다 김형오 전 국회의장은 이 대표에 대한 유죄 선고를 계기로 김 ,0,1
448, 기고 언론 후원의 힘,지난 월 일 새벽 시 한 인터넷 매체가 김건희 여사 총선 공천 개입 이라는 제목으로 기사 한 꼭지를 쏘아 올렸다 언론사 이름은 낯선 뉴스토마토 라는 곳이었다 김건희 여사의 소위 디오르 백 뇌물 파장을 최초 ,1,1
449, 노무현 이래 정치검찰과의 싸움 탄핵 특활비 삭감 칼 간다,민주당은 또 오는 일 본회의에서 김건희 여사의 도이치모터스 주가조작 의혹 을 불기소 처분한 이창수 서울중앙지검장 등 검사 명에 대한 탄핵소추안 처리를 추진할 계획이다 이와 함께 법사위에서 의결된 검찰 ,0,1
450, 이재명은 죽지 않는다 초강경투쟁 나서는 ,이 대표는 심 선고 하루 뒤인 일 서울 광화문에서 개최된 김건희 윤석열 국정농단 규탄 및 특검 촉구 민주당은 일 김건희 특검법 관철을 위한 차 비상행동 에 돌입해 국회 내 농성도 이어간다 농성은 윤 ,1,0
451,비명계 잠룡들 암중모색 ,김동연 경기지사는 일 서울 광화문 앞에서 열린 김건희 윤석열 국정농단 규탄 특검 촉구 국민행동의 날 집회에 처음 참석했다 집회 종료 후엔 페이스북에 나라의 앞길이 걱정이다 끝까지 함께하겠다 고 ,0,0
452, 사설 자성도 쇄신도 안 보이는 국민의힘 즐길 때 아니다,윤석열 대통령과 한동훈 대표는 그동안 김건희 여사 문제를 두고 여러 번 충돌했고 이는 친윤 친한 계파 갈등으로 번졌다 윤 대통령이 뒤늦게 김건희 여사 문제를 사과하는 회견을 하자 국민의힘은 민주당이 세 번째로 ,0,1
453, 이재명 일극체제는 시한부 여당 반사이익 기대는 착각 ,대통령 김건희 여사 리스크 에 기대하고 있다 며 민주당 내부에서 무언가 바꿔보자는 얘기가 민주당은 일 김건희 특검법 재표결을 앞두고 장외집회 등을 통해 대여투쟁 공세를 높이고 있다 심 선고 이후 이재명 ,0,1
454, 사설 대표 유죄선고에 미친 판결 정치판결 이라는 의 궤 ,그제 서울 광화문 북측광장에서는 윤석열 대통령과 김건희 여사를 비판하는 제 차 국민행동의 날 집회가 열렸다 민주당뿐만 아니라 조국혁신당 진보당 등 군소 야당까지 집회에 참여했다 여기서 떨어진 동화면세점 ,1,1
455, 사설 구속 대통령 공천개입 의혹 뭉개버리면 안 돼,이 의원은 또 당시 특정 인사가 김건희 여사랑 가깝다는 이유로 포항 바닥에서 본인이 공천을 받을 것 이라고 하고 다닌다는 정보가 들어왔다 고 주장했다 이 의원은 김 여사를 서울 서초구 아크로비스타 ,0,1
456, 서 잇단 때리기 반사이익에 기대지 않겠다 ,한 대표는 김건희 여사 특검법 표결이 있던 지난 일 의원총회에서도 이 대표 유죄 선고의 반사이익만으로는 안 된다 고 발언했다 한 대표는 이날 민주당 주도로 입법한 검수완박 검찰 수사권 완전 박탈 ,0,1
457, 미술관 속 해부학자 깃털보다 가벼운 심장을 가지려면, 김건희 여사의 주가조작 연루 의혹과 명태균 씨 국정농단 의혹은 연일 특검 요구에 시달린다 정치의 사법화 현상이 어제오늘 일은 아니지만 극도로 갈라진 여론은 더더욱 주요 정치 사회 사안의 사법부 의존도를 ,1,1
458, 김건희 특검 시민서명운동 민주당 하루 만명 참여 ,더불어민주당 울산시당 시당위원장 이선호 은 지난 일부터 김건희 특검 촉구 울산 시민 서명운동 사진 에 울산 시민의 적극적인 참여가 이어지고 있다고 일 밝혔다 민주당 울산시당에 따르면 총 곳의 ,0,1
459,여야 사생결단 돌입 일 일이 분수령,오는 일 예정된 이 대표의 위증교사 혐의 사건 심 선고와 일 김건희 특검법 재표결 결과가 중대 이 대표는 전날 서울 광화문 일대에서 열린 김건희 윤석열 국정농단 규탄 및 특검 촉구 제 차 집회 연단에 ,1,1
460, 칼럼 이 대표의 민주주의 재판부의 민주주의,이 나라의 주인은 윤석열 김건희 명태균으로 바뀐 것 같다 고 비판했다 박찬대 민주당 원내대표 역시 법기술자들이 국민주권을 침해하고 법치를 우롱 한 국민의 법감정을 벗어난 정치판결 이므로 민심의 ,1,1
461, 사설 이재명 판결에 사생결단 정국 국정 민생 실종 안 된다,도이치모터스 주가조작 사건 무혐의 등 김건희 여사를 굳이 거론하지 않더라도 윤 대통령은 대장동 사건의 핵심피고인 김만배씨와 개인적 친분이 없다 는 취지로 말했다가 허위사실 공표로 고발되는 등 건이 모두 ,0,0
462, 명경대 춘천시장의 거부권 행사, 년 월 일 양곡관리법 개정안과 월 일 간호법 제정안을 시작으로 올해는 월 화천대유 억 클럽 특검법 김건희 도이치모터스 주가조작 의혹 특검법 이태원 압사 사고 이태원 참사 특별법 건 등이다 지자체장이 ,0,1
463, 사설 민주당은 범죄자 이재명을 당장 출당시키라,더구나 이 대표는 역공을 취하기 위해 일 일에 이어 일 김건희 여사 특검 을 내걸고 정부 규탄 장외집회를 가졌다 거기에 더해 경찰이 정당한 집회에 폭력을 행사했다 주장하고 행정안전위원회에서 예산을 ,0,0
464, 사설 위증교사 재판에서 법정구속도 적극 검토하라,이 대표는 일 서울 광화문광장에서 열린 김건희 윤석열 국정농단 규탄 특검 촉구 시민사회 연대 집회 에서 이재명은 죽지 않는다 며 우리가 이 세상의 주인이라는 것을 그들에게 똑똑하게 보여주자 고 주장했다 ,0,1
465,이준석 포항 강서구 공천 개입 이철규 사실무근 ,개혁신당 이준석 의원이 당선인 신분이었던 윤석열 대통령과 김건희 여사의 공천 개입 의혹에 대한 폭로를 이어가고 있다 이 의원은 지난 일 국회의원회관에서 기자간담회를 열고 윤 대통령이 당선인 시절 국민의힘 ,1,1
466, 징역형 집유 이재명 대표 선고에 엇갈린 강원 정치권,또 같은날 서울 광화문에서 김건희 윤석열 국정농단 규탄 특검 촉구 국민 행동의 날 집회를 통해 규탄의 목소리를 냈다 송기헌 원주을 의원은 판결 직후 기본적 사실 인정부터 수긍하기 어려운 터라 비통하고 슬픈 ,1,1
467, 징역형에 반격 기회 얻은 김 여사 특검 방어 가능할까,오는 일 예상되는 김건희 여사 특검법 재표결에서도 이탈표가 나올 가능성이 적어졌다는 관측도 나온다 이 김건희 여사 특검법 재표결에 있어서도 이탈표 걱정은 줄었다는 분석도 나온다 국민의힘은 그동안 민주당의 ,1,1
468,최민희 비명계 움직이면 내가 당원과 함께 죽일 것 경고,최민희 더불어민주당 의원은 일 오후 광화문 일대에서 진행된 김건희 윤석열 국정농단 규탄 특검 촉구 제 차 국민행동의 날 집회 현장에서 유튜브 오마이 등 유튜버들과 만나 이미 일부 언론이 민주당에 ,1,1
469, 윤석열 임기후반기 국정 동력 회복 인사 에 달렸다 연내 개각 대 ,윤 대통령은 총선 참패 후에도 극우 뉴라이트 인사를 중용하며 여론의 질타를 받았으며 김건희 여사가 최근 의정갈등 장기화와 김건희 여사 문제 명태균 녹취록 등 악재가 연이어 터지면서 지지율이 대까지 주저 ,1,1
470, 김능구 황장수의 닥터둠의 전망 월 이재명 심 선고 앞두고 윤석열 ,김 대표가 김건희 여사가 윤 대통령을 리모콘으로 조종하고 있다는 내용을 묘사한 만평에 대해 언급하자 황 김 대표는 최고의 책사가 꼭 김건희 여사인 것 같다 겉으로 볼 때 메시지라든가 인적 쇄신은 할 것 이라고 ,0,1
471, 죽지 않는다 는 이재명에 진중권 죽는 건 주변 사람들 ,이 대표는 일 서울 종로구 광화문 일대에서 열린 김건희 윤석열 국정농단 규탄 특검 촉구 제 차 윤석열 김건희 명태균으로 바뀐 것 같다 고 현 정권에 대한 비판의 목소리를 높였다 이에 진 교수는 일 자신의 ,0,1
472, 광화문에서 황성호 경찰도 납득 못 하는 신상공개 제도의 허점,윤석열 대통령과 김건희 여사 부부 공천개입 의혹의 핵심 인물인 명태균 씨에 대한 사전 구속영장 실질심사와 이재명 더불어민주당 대표의 공직선거법 위반 사건 심 판결을 목전에 둔 이달 일 향후 정국을 요동치게 ,0,1
473, 독자위원회 언론 대선 예측 빗나가 여론조사 문제점과 한계 분석 ,이런 부분들을 기사에서 자세히 짚었다면 결국 윤 대통령의 행위보다 김건희 여사의 국정 개입 여부가 문제의 핵심이라는 시사점을 줄 수 있었을 것입니다 최은봉 위원 한강 작가의 노벨 문학상 수상과 관련해 월 ,0,0
474,민주당 검독위 심 선고 재판부 정치검찰 공작에 동조한 정치판결 ,이들은 재판부는 년 전 대선 과정에서 했던 말 한두 마디를 비틀고 증언을 취사 선택해 판결함으로써 윤석열 정권을 견제할 유일한 대안인 제 야당 대표 정치생명에 심대한 타격을 줬다 며 윤석열 김건희 국정농단으로 ,0,1
475,민주 단일대오 다짐 한동훈 위증교사 정조준,칠불사 홍매화 사건이 터지기 직전까지는 뉴스토마토라는 매체의 핵심이 뭐냐 하면 김건희 여사와 윤 지금 더 나아가서는 김건희 여사와 관련한 그런 녹취록까지 폭로를 하고 있는 그런 상황이거든요 그러면 이 얘기는 ,0,1
476, 스트레이트 정권 한 달 안에 무너진다 큰소리치던 명태균은 왜 ,국회는 세 번째 김건희 여사 특검법 을 통과시켰다 윤 대통령은 이번에도 거부권을 행사할 것으로 보인다 탐사기획 스트레이트 는 매주 일요일 저녁 시 분에 방송된다 ,1,0
477, 사설 사법리스크 현실화 로 인한 극단정치 경계해야,더불어민주당 이재명 대표가 일 오후 서울 광화문광장 인근에서 열린 김건희 윤석열 국정농단 규탄 명분은 윤석열 대통령 부부의 공천 개입 의혹을 비난하고 김건희 여사 특검을 주장하며 정권퇴진을 요구한다는 ,0,1
478,이재명 심 유죄 국힘 강공 드라이브 로 압박, 김건희 여사 특검법 반대를 당론으로 정한 원내지도부는 윤 대통령의 재의요구권 행사 이후 일로 예상되는 재표결에서도 이탈표를 최소화할 것으로 자신한다 김 여사 이슈로 다시 표면화한 윤 대통령과 한 대표의 ,0,1
479,창원지검 대선 여론조사 조작 대가성 혐의 수사,명태균 씨가 김건희 여사로부터 돈을 받았다 고 진술하면서 이에 대한 신빙성 여부를 입증할 수 있을지 관건이지만 공천개입 정황이 한층 짙어지는 모양새다 이 돈은 돈봉투로 지난 년 월 전달된 것이라고 명씨가 ,0,0
480,민주 당황 혼란 재판부 증언 취사선택 , 억원 반환 걸려 당 법적 대응 검찰 조작 기소 표현의 자유 위축 공격이 최고의 방어 김건희 연합뉴스 더불어민주당과 야권 연합이 김건희 윤석열 국정농단 규탄 집회를 이어가고 있는 ,0,1
481, 정동칼럼 윤 대통령 주술정치를 벗어야,주술이 심각한 걱정으로 커지기 시작한 것은 부인 김건희 의 녹취록이 나오면서였다 김건희 는 나는 영적인 사람이고 도사들과 얘기하는 것을 좋아한다 고 말했다 자신의 주술적 능력을 자랑하는 그의 말이 심상치 않게 ,1,1
482,민주 이재명 재판 당 차원 대응 흔들림 없다 , 김문수 더불어민주당 검찰 독재 대책위 제보센터장 윤석열 김건희 국정농단으로 인한 정권의 위기 일각에선 재판 결과가 민주당이 당력을 집중해온 김건희 여사 특검법 재표결에도 악영향을 끼칠 수 있다는 우려가 ,0,1
483,민주당 이재명 교체 고려 안 해 정권 심판 위해 싸울 것 ,대여 투쟁과 관련해서는 국회서 김건희 특검과 상설특검을 통해 윤 정부를 심판할 수 있도록 노력하는 한편 국민이 목소리를 낼 수 있는 장을 만들어 계속 싸워나가겠다 고 답했다 그는 정부 예산안 심사에 대해서는 ,0,1
484,윤 정권 퇴진 요구 확산 시민사회 정치권 가세,오는 일 전주 풍남문 광장에서는 정권 퇴진을 위한 조국혁신당의 탄핵다방 이 열립니다 민주당 전북도당은 윤 대통령과 김건희 여사의 국정농단을 규탄하고 특검을 촉구하는 서명운동을 이어가고 있습니다 ,1,1
485,친명 최민희 비명계 움직이면 내가 죽일 것 ,친명인 최 의원은 이날 오후 광화문 일대에서 진행된 김건희 윤석열 국정농단 규탄 특검 촉구 제 차 국민행동의 날 집회 현장에서 유튜브 오마이 등 유튜버들을 만나 어떤 판결이 나오느냐가 중요한 게 아니라 ,0,1
486, 이재명은 죽지 않는다 민주당 장외 공세,도로에서 김건희 윤석열 국정농단 규탄 특검 촉구 제 차 국민행동의 날 집회를 개최했다 일 오후 서울 종로구 광화문 일대에서 김건희 특검 수용 국정농단 규명 윤석열을 거부한다 시민행진 집회가 진행되고 ,0,0
487, 명태균 김영선 구속 경남 현안 유력 정치인 중앙정치권 전방위 , 김건희 여사 공천 개입 의혹과 미래한국연구소의 불법 여론조사 의혹 등 사건의 핵심 인물인 국민의힘 이밖에도 명씨가 경남 지역의 공공기관장 인사에 개입했다거나 윤 대통령의 부인 김건희 여사로부터 만원이 든 ,1,1
488, 유죄 판결에 여야 공세 수위 고조,한민수 대변인은 브리핑에서 전날 선고에 대해 어떻게든 윤석열 대통령과 김건희 여사와 관련해 터져 더불어민주당 이재명 대표가 지난 일 서울 광화문광장 인근에서 열린 김건희 윤석열 국정농단 규탄 특검 ,1,1
489,추경호 친한 친윤 물밑 중재 단일대오 끌어내,최소화하고 김건희 여사 특검법 반대 라는 당의 단일대오를 끌어내는 데 공을 들인 것으로 알려졌다 추 친윤계 중진은 물론 특별감찰관 반대 의사를 밝힌 의원들을 따로 접촉해 김건희 여사 특검법 저지 등도 당론으로 ,0,0
490, 판사 겁박 최악 양형 사유 ,같은 날 오후 광화문 인근에서 열린 김건희 윤석열 국정농단 규탄 및 특검 촉구 차 집회 에서 참가자들이 민주당은 이날 서울 광화문 광장에서 김건희 윤석열 국정농단 규탄 및 특검 촉구 를 주제로 장외 집회를 ,0,1
491, 스트레이트 확 다 불어버릴까 그리고 닫힌 입 명태균 게이트 는 어 , 두 시간 뒤 국회 본회의엔 김건희 여사 특검법 이 상정됐습니다 이번이 세 번째입니다 주진우 국민의힘 김건희 여사 특검법 은 다시 국회를 통과했습니다 오늘 스트레이트는 이른바 명태균 게이트 에서 앞으로 ,1,1
492,검찰 명태균 김건희 여사 대화사진 장 추가 확보,이 가운데는 김건희 여사와 나눈 대화 캡처본 장이 포함된 것으로 확인됐습니다 최진석 기자의 보돕니다 이 가운데는 명 씨가 김건희 여사와 나눈 텔레그램 대화 캡처본 장도 포함된 것으로 취재 결과 ,1,0
493,박장범 사장 후보 김건희 여사와 소통한 적 없어 ,지난 월 윤석열 대통령과의 신년대담을 진행하면서 김건희 여사가 받은 명품백을 파우치 외국 회사 조그마한 백 이라고 한 것에 대해선 문제가 없다는 입장을 고수했다 박 후보자는 일 국회 ,1,0
494, 단독 검찰 명태균 김여사 새 대화사진 확보 사진 만장 등 복구,이 가운데는 명 씨가 김건희 여사와 나눈 텔레그램 대화 사진 장이 포함됐고 그동안 알려지지 않은 내용도 이 가운데는 명 씨가 김건희 여사와 나눈 텔레그램 대화 사진 장도 포함됐습니다 이 대화는 대 총선을 ,1,1
495,김여정 대북전단에 격분 북 또 오물 풍선 살포할 듯,북한은 지난달 일 윤석열 대통령과 김건희 여사를 비난하는 내용의 전단이 담긴 풍선을 보냈다 북한의 오물 풍선 살포에 남한은 남북군사합의 전체 효력 정지 대북 확성기 방송 전면 실시로 맞섰다 지난달 평양 ,0,0
496,검찰 대통령 부부 공천개입 의혹 수사 성패 가를 운명의 주,향후 검찰의 칼끝은 윤 대통령과 김건희 여사의 공천개입 의혹과 명씨의 여론조사 결과 조작 의혹 등으로 향할 것으로 보인다 일 검찰 등에 따르면 창원지검 수사팀 팀장 이지형 차장검사 은 명씨에 대한 구속영장을 ,1,0
497,명태균 김건희 도이치모터스 대책 회의 사실도 공유했다,명태균이 지난 대선 당시 김건희 여사가 도이치모터스 주가조작 의혹 관련 검찰 서면조사 대책회의를 이에 더불어민주당은 일 오후 논평을 통해 도대체 김건희 여사는 명태균 씨와 얼마나 긴밀한 관계를 유지한 ,1,1
498,이재명 유죄 파장 죽지 않는다 지만 리스크 첩첩산중 , 차 관문도 못 넘어 위기 김건희 특검 동력 약화 우려 민주당 변함없는 단일대오 여론 따라 하지만 야권에서는 이 대표의 사법 리스크가 현실화된 만큼 윤석열 대통령 부부 공천개입 의혹 김건희 여사 관련 ,1,0
499,극비였던 김 여사 검찰 서면조사 명태균은 미리 알았다 ,윤석열 대통령 부부 공천개입 의혹의 핵심 인물인 명태균씨가 지난 대선 당시 김건희 여사가 도이치모터스 주가조작 의혹 관련 검찰 서면조사 대책회의를 한다는 사실도 알고 있었다는 의혹이 일 제기됐다 해당 ,0,0
500, 사법리스크 현실화 특검법 동력 상실, 경상매일신문 민영일기자 이재명 더불어민주당 대표의 사법 리스크가 현실화하면서 김건희 특검법 동력이 민주당은 정부 여당에 흠집을 내며 김건희 특검법 재통과에 만전을 기하고 있다 강유정 민주당 ,0,1
501,민주 이재명 교체 전혀 고려 안 해 당 차원 변호인단 구성 검토 ,김 사무총장은 대여 투쟁과 관련해서는 국회서 김건희 특검과 상설특검을 통해 윤 정부를 제대로 심판할 수 있도록 노력하는 한편 국민이 목소리를 낼 수 있는 장을 만들어서 계속 싸워 나가겠다 고 답했습니다 정부 ,0,1
502,이재명 난 죽지 않아 진중권 죽는 건 주변 사람들 ,앞서 이 대표는 같은 날 광화문 일대에서 열린 당 주최 김건희 윤석열 국정농단 규탄 및 특검 촉구 제 차 집회에서 펄펄하게 살아서 인사드린다 이재명은 결코 죽지 않는다 라고 말했다 진 교수는 유죄판결 증거로 ,1,1
503, 천지일보 사설 심 판결을 정치 공세로 맞서는 이 대표 법원 판단 존 ,주최 김건희 윤석열 국정농단 규탄 및 특검 촉구 제 차 집회에서 지지자들을 향해 이재명 펄펄하게 살아서 인사드린다 이재명은 결코 죽지 않는다 라고 말했다 이어 어느 순간부터 이 나라의 주인은 윤석열 김건희 ,0,1
504,포항시장 공천 경선 논란 재점화,대통령과 김건희 여사를 포항시장 공천 한복판으로 끌여들였다는 점에서 그 파장이 간단치는 않을 전망이다 예비후보가 김건희 여사와 가깝다는 이유로 공천을 받을 거라고 하고 다닌다는 정보가 들어와 확인하기 위해 ,0,0
505, 스트레이트 명태균 게이트 여론조사 조작 의혹의 실체,한 김영선 전 의원 공천 의혹과 또 다른 공천개입 의혹 국회는 세 번째 김건희 여사 특검법 을 통과시켰다 윤 대통령은 이번에도 거부권을 행사할 것으로 보인다 탐사기획 스트레이트 는 일 오후 시 분에 방송된다 ,1,0
