,title,description,title_label,description_label
215,이재명 김건희 특검 반드시 통과돼야 ,이재명 더불어민주당 대표가 김건희 여사 특검법이 반드시 통과돼야 한다고 재차 강조했습니다 이 대표는 오늘 일 오전 국회에서 열린 최고위원회의에서 민주공화국의 주인은 주권자인 국민이고 국민들이 이 나라의 ,1,1
216,이재명 불공정한 권한 행사로 국가 질서 어지렵혀 ,그는 검찰이 제대로 하지 못하면 특별검사를 임명해 훼손되는 법 절차와 법 질서를 지키는 것이 당연하다 며 김건희 특검법 은 반드시 통과되어야 한다 고 강조했다 검찰이 김건희 여사를 둘러싼 각종 의혹을 ,1,0
217,민주 무죄로 단일대오 윤 대통령 부부 논란 직격,예상되는 김건희 여사 특검법 의 재표결을 앞둔 상황에서 내부 분열이야말로 당의 더 큰 위기라는 인식이 특히 시민단체와 함께 집회를 개최해 김 여사의 각종 의혹을 규명할 김건희 여사 특검법 의 수용을 압박할 ,0,1
218, 거짓 에 단죄당한 이재명 국민도 그를 버리기 시작했다 포커스 ,일대에서 김건희 윤석열 국정농단 규탄 특검 촉구 제 차 국민 행동의 날 집회를 열었다 이 대표가 일 장외집회는 김건희 여사를 겨눈 특검 촉구와 정부 규탄을 명분으로 시작했지만 이 대표의 무죄를 주장하는 ,0,1
219,국힘 분풀이식 검찰 특활비 삭감 정부안대로 되돌려놓겠다 ,김 의장은 민주당이 김건희 예산 이라고 한 사업 예산에 대해서도 사수 의지를 밝혔다 민주당은 김 여사가 관심을 기울인 개 식용 종식 관련 예산 억원 자살예방 등 마음 건강 지원 사업 예산 억원의 감액을 ,1,0
220,박찬대 이재명 심 판결은 명백한 사법살인 ,박 원내대표는 야당 대표와 배우자는 년 넘게 수사와 재판을 받는데 김건희 여사는 기소조차 되지 뒤이어 대통령과 국민의힘이 특검을 거부한다면 국민이 끝까지 죄를 물을 것 이라며 정부 여당에 김건희 여사 ,0,1
221, 김건희 특검 촉구 차 비상행동 돌입 일 장외집회도 예고, 일 김건희 특검법 관철을 위한 차 비상행동에 돌입한다 황정아 민주당 대변인은 이날 최고위원회의 후 오늘 오후 시 선포식을 개최하고 오는 일까지 비상행동을 이어갈 예정 이라고 말했다 민주당은 또 김건희 ,0,1
222,이재명 김여사특검 임명해 훼손되는 법질서 지켜야 ,따라서 김건희 여사 특검이 반드시 실현될 수 있도록 최선을 다하겠다 고 밝혔다 이재명 대표는 이날 오전 앞서 수사대상을 도이치모터스 주가조작 의혹과 공천개입 의혹 등으로 한정한 김건희 여사 특검법 은 이 ,0,1
223, 이슈 인사이트 그들만의 조지 오웰식 국어사전 ,아내 김건희 여사에게 제기된 의문에 대해 부인이 남들한테 좀 욕 안 얻어먹고 원만하게 잘하기를 바라는 궁금증이 많은 한 네티즌이 국립국어원 홈페이지에 정말 김건희 여사의 행동을 국정농단으로 칭할 수 없는 ,0,0
224,이재명 국민 다수 바라는 특검 거부권 예상 ,이투데이 정성욱 기자 | 민주당 최고위원회의서 발언 특검 실현 최선 주가 하락 외인 주식 비중 최저 정책 전환해야 이재명 더불어민주당 대표가 국민의 압도적 다수가 김건희 여사 특검을 바라고 있는 만큼 ,0,1
225,박찬대 이재명 심은 사법살인 보수서도 비판 나와 ,박 원내대표는 이 대표에 대한 심 판결이 윤석열 대통령과 배우자 김건희 여사를 압박하는 기폭제가 될 것이라고도 말했다 그는 이번 엉터리 판결로 김건희 윤석열 처벌 여론이 늘었다 국민들은 그런데 김건희 는 ,1,1
226,이재명 이 나라 대통령 것 아냐 특검으로 법질서 지켜내야 ,이재명 더불어민주당 대표가 김건희 특검법 이 반드시 통과돼야 한다면서 검찰이 제대로 하지 못하면 이어 주권자 국민이 이 나라의 법질서 회복을 바라고 있다 며 김건희 특검법은 반드시 통과돼야 한다 고 ,0,1
227,이재명 국민 압도적 다수가 바라는 특검 실현에 최선 ,더불어민주당 이재명 대표는 오는 일 국회 재표결이 예상되는 김건희 여사 특검법 을 국민의 압도적 다수가 바라고 있다며 반드시 통과되어야 한다고 말했습니다 이 대표는 최고위원회의에서 검찰이 불공정한 권한 ,1,1
228,이재명 김건희 특검법 거부권 예상 나라는 대통령 혼자 것 아냐 ,이 대표의 발언은 검찰이 김건희 여사의 각종 의혹을 수사하는 데 소극적이라는 점을 언급하며 김건희 여사 특검법 의 필요성을 강조한 것으로 풀이됩니다 이 대표는 국민이 이 나라의 법 질서 회복을 바란다 며 특검은 ,0,1
229,이재명 김건희 특검법 반드시 통과 유죄 선고 뒤 첫 공개발언,당연하다 며 김건희 특검법 처리를 거듭 압박했다 공직선거법 위반 혐의로 지난 일 심에서 의원직 이 대표는 대통령의 김건희 특검법에 대한 거부권 행사가 예상된다 면서도 그러나 국민의 압도적 ,1,1
230,민주 이재명 방어 총력전 윤 대통령 부부 겨냥하며 전열 정비,민주당 내에서는 오는 일 이 대표의 위증교사 혐의 심 선고를 비롯해 윤석열 대통령이 재의요구권을 행사할 경우 일로 예상되는 김건희 여사 특검법 의 재표결을 앞둔 상황에서 분열이야말로 당의 더 큰 위기라는 ,0,1
231, 김건희 예산 지키고 검찰 특활비 복원 국민의힘 내년도 예산안 심 ,국민의힘은 일 야당이 추진하는 김건희 표 예산 삭감을 저지하고 상임위원회에서 삭감된 검찰 김건희 표 예산으로 불리는 개 식용 종식 마음투자 지원 예산에 대해서는 삭감을 저지하겠다는 의지를 밝혔다 김 ,1,0
232,조국 민주당 김건희 특검법은 올리면서 왜 검찰개혁법은 안 올리나 ,조국 조국혁신당 대표는 일 더불어민주당을 향해 김건희 특검법은 대통령이 거부할 것을 감수하면서도 본회의에 올리면서 왜 검찰의 수사 기소 분리 법안은 올리지 않는 건가 라고 지적했다 조 대표는 이날 오전 ,0,1
233, 대통령이 김건희 머슴이냐 퇴진 교수도 직격 ,또 대통령 부인으로 내조만 하겠다던 김건희 여사가 권력을 이용해 국정을 농단하는 작금의 사태를 지켜보기에는 인내의 한계점에 도달하였다 며 윤석열 대통령은 대한민국 대통령이 아닌 김건희 여사의 머슴 이냐고 ,0,0
234,이재명 권한남용 범죄 은폐로 질서 어지럽혀 특검 통과돼야 ,특검은 반드시 통과돼야 한다 며 김건희 여사 특검법 의 필요성을 강조했다 이어 대통령의 특검법에 대한 거부권 재의요구권 행사가 예상되지만 이 나라는 대통령 혼자의 것이 아니다 라며 국민의 압도적 다수가 ,0,1
235,이재명 심 언급 없이 김건희 특검법 통과돼야 ,이재명 더불어민주당 대표가 일 오전 서울 여의도 국회에서 최고위원회의를 마친 후 이석하고 있다 뉴스 ,0,1
236,창원지검 대통령 내외 고발 시민단체 대표 일 고발인 조사,이 단체는 지난달 일과 일 두 차례에 걸쳐 윤석열 대통령과 김건희 여사 명태균씨 김영선 전 의원 하고 김건희 여사와 친분을 통해 김 전 의원의 보궐선거 공천을 약속받았다고 주장해 왔다 검찰은 지난 일 명 ,0,1
237,조국혁신당 민주당 얼마나 더 당할건가 수사 기소 분리 동참하라 ,한편 김건희 여사가 자신과 윤 대통령이 정치적 고비에 처할 때마다 역술인들에게 정치적 조언을 구했다는 보도에 대해 조 대표는 무속 중독 이라고 꼬집었다 그는 윤석열 김건희 부부는 사주나 무속 풍수 등에 ,0,1
238,박장범 디올백은 파우치 조그만 백 발언 영어를 우리말로 풀어 쓴 ,박장범 사장 후보자가 김건희 여사 디올백은 파우치 혹은 조그마한 백 이라고 발언했던 것에 대해 때 김건희 여사 디올백은 파우치 혹은 조그마한 백 이라고 말했던 것과 관련해 영어를 우리말로 풀어쓴 것 ,1,0
239,민주당 미친 판결 비난 판사 탄핵 엔 소수 의견 ,이어 실제 발언을 왜곡 짜집기한 것을 유죄로 인정한 판결은 전제부터 틀렸고 심지어 헌법재판소의 판결과 대법원 판례마저 무시한 판결로 법적 안정성과 신뢰성을 크게 훼손했다 며 이번 엉터리 판결 이후 김건희 ,0,0
240,이재명 심 선고 후 첫 최고위 김건희 특검법 통과돼야 ,이재명 더불어민주당 대표가 일 오전 서울 여의도 국회에서 최고위원회의를 마친 후 이석하고 있다 뉴스 ,1,1
241,최민희 비명계 움직이면 죽는다 당원과 함께 죽일 것 발언 논란,최 의원은 이날 오후 오후 광화문 일대에서 진행된 김건희 윤석열 국정농단 규탄 특검 촉구 제 차 국민행동의 날 집회에 나와 오마이 등 유튜브 채널과의 인터뷰에서 다시 숨죽이고 있던 민주당 내 분열 세력들이 ,0,1
242,이재명 대표 김건희 특검법 반드시 통과돼야 ,이재명 더불어민주당 대표가 일 오전 서울 여의도 국회에서 열린 최고위원회의에 참석해 발언하고 있다 뉴스 ,1,1
243,이재명 김건희 특검법 반드시 통과돼야 ,이재명 더불어민주당 대표가 일 오전 서울 여의도 국회에서 열린 최고위원회의에 참석해 전현희 최고위원 발언을 들으며 생각에 잠겨 있다 뉴스 ,1,1
244,이재명 민생 행보 지속 무협 전상연 등 만나며 외연 확장,한편 민주당은 김건희 특검법 관철을 위해 이날부터 차 비상행동에 돌입한다 이와 함께 오는 일에는 시민사회와 함께 수도권 집중 장외집회를 일에는 전국 단위의 집회를 계획하고 있다 ,1,1
245,이재명 민주공화국 주인은 국민 김민석 서초동 주인도 국민 , 김건희 특검 관철을 강조한 메시지였지만 지난 일 나온 이 대표의 선거법 위반 사건 판결과 맞물려 눈길을 끌었다 이 대표는 일 당 최고위 공개회의에서 질서 유지의 최후 보루라고 할 검찰이 검찰권을 남용하고 ,0,0
246,박찬대 이재명 심 엉터리 판결 명백한 사법살인 ,박 원내대표는 오히려 김건희 여사와 윤석열 대통령이 처벌받아야 한다고 주장했습니다 그는 제 야당 대표와 배우자가 년 넘게 수사와 재판을 받고 있는데 왜 김건희 여사에 대한 수사는 제대로 이뤄지지 않고 심지어 ,0,1
247,민주 일 장외집회 이재명은 민생 행보 ,민주당은 지난 일 김건희 윤석열 국정농단 규탄 특검 촉구 장외 집회를 시작으로 지난 일까지 총 차례의 정권 규탄 집회를 진행했다 원내는 김건희 특검법 관철을 위한 차 비상행동에 돌입한다 황 대변인은 ,0,0
248,이재명 검찰 권한 남용 범죄 은폐로 나라 어지럽혀 ,검찰이 윤 대통령 측근의 각종 의혹을 수사하는 것에 소극적이라는 점을 짚고 김건희 여사 특검법의 필요성을 다시 한번 역설한 것으로 풀이된다 이 대표는 이 나라는 대통령 혼자의 것이 아니다 라며 국민의 압도적 ,0,1
249,이재명 검찰 권한남용 범죄 은폐 특검 통과돼야 ,이는 검찰이 윤석열 대통령의 부인 김건희 여사의 각종 의혹을 수사하는 데 소극적이라고 지적하면서 김 여사 특검법 의 필요성을 역설한 것으로 보인다 그는 국민이 이 나라의 법 질서 회복을 바란다 면서 특검은 ,0,0
250, 이 나라는 대통령 혼자의 것이 아니다 이상섭의 포토가게 , 이번 김건희 여사 특검법은 반드시 통과돼야 한다 며 대통령의 거부권 행사가 예상되지만 이 나라는 이상섭 기자 이 대표는 선고 다음 날인 지난 일 서울 광화문 앞에서 열린 김건희 윤석열 국정농단 규탄 및 ,0,1
251,이재명 김건희 특검법 이번에 반드시 통과돼야 ,이재명 더불어민주당 대표가 일 김건희 여사 특검법 에 대해 이번 특검은 반드시 통과돼야 한다 고 이 대표는 이 선고 다음 날인 지난 일 서울 광화문 앞에서 열린 김건희 윤석열 국정농단 규탄 및 특검 촉구 차 ,1,1
252,박형욱 위원장 무조건 협상 없다 책임자 문책하라 ,의료 소송 위험을 다루면서 김건희 여사의 명품 가방 수수 논란도 언급했다 박 위원장은 정부 의료사고심의위원회 에서 의사 중과실이 아니라고 판단해도 검사가 기소하면 막을 방법이 있느냐 면서 대검찰청 ,0,1
253,이재명 검찰 불공정 권한 행사로 국가 질서 어지럽혀 , 김건희 여사 특검법 관철 의지도 드러냈다 그는 검찰이 제대로 못 하면 특검을 임명해 훼손되는 법 절차와 질서를 지켜내야 하는 건 너무 당연하다 며 이번 특검은 반드시 통과돼야 한다 대통령 거부권 행사가 예상이 ,1,0
254,명품백 들고 질의하는 조인철 의원,박장범 한국방송공사 사장 후보자 인사청문회에서 박 후보자가 윤석열 대통령과의 신년대담을 진행하면서 김건희 여사가 받은 명품백을 파우치로 표현한 것에 대해 명품백을 들고 질의하고 있다 뉴스 ,1,1
255,홍준표 뒷담화하고 당원 게시판에 비방글이나 쓰는 비열한 짓 하지 말 ,최근 국민의힘 내부에서는 윤석열 대통령과 김건희 여사를 비난한 당원 게시판 글과 관련된 논란이 이어지고 있다 해당 글의 작성자가 한 대표와 그의 가족들의 이름과 같다는 의혹이 제기되며 친윤 친윤석열 계에서는 ,0,1
256,박찬대 이재명 심 판결에 사법 살인 법적 안정성 훼손 ,박 원내대표는 이번 엉터리 판결 이후 김건희 여사와 윤석열 대통령도 처벌받아야 한다는 여론이 확산하고 있다 면서 제 야당 대표와 배우자가 년이 넘게 수사받고 재판받는데 왜 김건희 여사에 대한 수사는 제대로 ,0,1
257, 이재명 심 후폭풍 야당 정치판결 여당 일 법정구속 ,다만 반사이익 은 크지 않을 거라며 김건희 여사 문제 등으로 불거진 당내 쇄신 과정은 이어가야 한다는 목소리도 적잖습니다 당 지도부 핵심관계자는 대통령실에 대 개혁을 요구할 때도 여야의정 성사 노력을 ,0,1
258, 자유무역 기후위기 보호무역 기후허구 서 격돌하는 트 ,윤 대통령은 이번 순방에 김건희 여사와 동행하지 않았다 정의로운 세계와 지속가능한 지구 구축 을 주제로 열리는 제 차 리우 정상회의는 자유무역과 기후위기라는 반 트럼프 가치가 주요 의제로 다뤄질 ,0,0
259, 시선집중 명태균 측 질문비율 이준석 함성득은 거간꾼 ,거기서도 어느 순간부터 명 씨의 김건희 여사에 대한 정보가 정확하지 않았다 그래서 김종인 위원장의 사모님인 김미경 씨도 나한테 김건희 여사에 대한 정보가 좋지가 않더라 질이 안 좋다라고 이야기할 정도라고 ,1,0
260, 더 큰 것 온다 이재명 일 위증교사 심 초긴장 ,당 지도부는 김건희 특검법 통과로 맞대응하겠단 전략이다 이 대표는 이날 최고위원회의에서 이번 김 여사 특검은 반드시 통과돼야 한다 윤 대통령의 거부권 행사가 예상되지만 국민의 압도적 다수가 특검을 원하고 ,1,1
261,한동훈 재판 모니터링 이재명 권한남용 범죄 은폐 ,이 대표의 발언은 검찰이 김건희 여사의 각종 의혹을 수사하는 데 소극적이라는 점을 언급한 것으로 해석된다 이 대표는 이어 국민이 이 나라의 법 질서 회복을 바란다 며 특검 도입을 강조했다 이 대표는 또 ,0,0
262,이재명 여당에 김건희 특검법 수용 압박 압도적 다수의 뜻 ,이재명 더불어민주당 대표가 일 여당인 국민의힘을 향해 김건희 여사 특별검사법안 특검법 수용을 재차 촉구했다 이 대표는 이날 오전 서울 여의도 국회 본관에서 열린 당 최고위원회의에서 압도적 다수가 특검법 ,1,1
263,이재명 국민들이 법질서 회복 바라 특검에 최선 ,예상된다 며 그러나 이 나라는 대통령 혼자의 것이 아니다 라고 말했다 일 국회 본회의를 통과한 세 번째 김건희 여사 특검법은 윤석열 대통령이 기한 내 재의요구권을 행사하면 일 재표결이 이뤄질 것으로 보인다 ,1,1
264,박찬대 이재명 판결 뒤 대통령 부부도 처벌 여론 확산 ,박 원내대표는 최고위원회의에서 제 야당 대표와 배우자가 년 넘게 수사와 재판을 받는데 김건희 여사 수사는 제대로 이뤄지지 않고 기소조차 되지 않아 국민이 분노하고 있다며 이같이 말했습니다 이어 공천개입을 ,0,1
265,이재명 검찰이 국가 질서 어지럽히고 있어 ,이어 검찰이 제대로 하지 못하면 특별검사를 임명해 훼손되는 법 절차 질서를 지켜내야 하는 것은 너무 당연하다 며 김건희 특검법 은 반드시 통과되어야 한다 고 강조했다 그러면서 대통령 거부권 재의요구권 행사가 ,1,0
266,이재명 정치 궁극적 주체는 국민 법질서 회복 바란다 , 김건희 여사에 대한 특별검사법 통과를 촉구하는 맥락에서 나온 발언으로 본인 재판과 관련된 직접적 언급은 없었다 이 대표는 일 국회에서 열린 최고위원회의에서 정치의 궁극적 주체는 국민 이라며 민주공화국의 ,1,1
267, 리얼미터 지지율 하락세 멈춰 민생행보 해외순방에 상승 ,여야의정 협의체 출범 및 김건희 여사 순방 제외 지지율 상승 영향 여론조사 전문기관 리얼미터가 에너지경제 의뢰로 지난 일부터 일까지 전국 세 이상 유권자 명에게 윤 대통령의 ,0,0
268,박찬대 이재명 중형 에 그런데 김건희 는 윤석열은 , 그런데 김건희 는 그런데 윤석열은 박찬대 더불어민주당 원내대표가 제 야당 대표와 배우자는 년 넘도록 수사와 재판을 받고 있는데 김건희 여사는 기소조차 되지 않은 데 국민들이 분노하고 있다 고 말했다 박 ,0,1
269,최민희 비명계 움직이면 내가 당원과 함께 죽일 것 검찰 독재 정권 ,최 의원은 월 일 오후 광화문 일대에서 열린 김건희 윤석열 국정농단 규탄 특검 촉구 제 차 국민 행동의 날 집회에서 오마이 유튜브 인터뷰에서 민주당에 숨죽이던 비명계가 움직이기 시작했다 라고 주장했습니다 ,0,0
270,민주 방어 총력전 대통령 부부 겨냥하며 전열 정비,예상되는 김건희 여사 특검법 의 재표결을 앞둔 상황에서 분열이야말로 당의 더 큰 위기라는 인식이 읽힌다 특히 시민단체와 함께 집회를 개최해 김 여사의 각종 의혹을 규명할 김건희 여사 특검법 의 수용을 ,0,1
271,이재명 검찰 불공정한 권한 행사로 국가 질서 어지럽혀 ,이 대표는 이번 김건희 특검 은 반드시 통과돼야 한다 며 대통령의 거부권 행사가 예상되지만 이 나라는 혼자의 것이 아니고 국민의 압도적 다수가 특검을 바라고 있기 때문에 특검이 실현될 수 있도록 최선을 다하겠다 ,1,1
272,국민의힘 민생 미래 약자보호 중심 예산 조정 대한민국 발판 마련 ,구 의원은 야당에서 정치적 예산으로 호도하는 예산이 무엇인가 묻는 취재진 질문에 전 정부에서부터 청년의 극단적 선택을 줄이고자 편성한 예산을 김건희 예산 이라고 해 삭감하겠다고 하는 것으로 안다 며 용산 ,1,0
273,김민석 한동훈 게시판 수사에 쫄아 김건희 살리기 결국 팽 당할 것 ,김민석 더불어민주당 최고위원은 일 게시판 수사에 쫄아 김건희 여사 살리기에 나선 한동훈 국민의힘 김 최고위원은 김건희 를 살리자고 불장난을 마다 않는 범죄 집단으로 온 나라를 불안 지역으로 만들 건가 라며 ,0,1
274,공천 개입 폭로자로 돌아선 이준석 아침 매일경제 ,김기흥 전 대통령실 부대변인 김진욱 전 민주당 대변인 김광삼 변호사 김수민 시사평론가 아침앤매일경제 김은미앵커 이준석 공천개입 명태균게이트 김민석 장예찬 추가폭로가능성 명태균 김건희 ,0,1
275,박찬대 이재명 심 판결 역사에 오점 명백한 사법 살인 , 상식적이지 않은 판결 안정성 신뢰성 훼손 김건희 윤석열은 기소조차 안 돼 국민 분노 죄지었으면 박 원내대표는 윤석열 대통령과 김건희 여사를 겨냥한 발언도 이어갔다 박 원내대표는 제 야당의 대표와 ,0,0
276,국민의힘 민생 예산 증액 이재명 방탄용 삭감 되돌릴 것 ,김 의장은 이른바 김건희 여사 예산 이라며 민주당이 대폭 삭감한 예산에 대해서도 민주당도 당론으로 추진한 개식용 종식과 관련된 육견업계 지원금을 정치적 예산으로 호도했다 며 프레임 덧씌우기로 국민을 ,0,0
277,이재명 국민 법 질서 회복 바라고 있어 김건희 특검 반드시 통과 ,아울러 이 대표는 이번 김건희 특검은 반드시 통과돼야 한다 며 대통령의 거부권 행사가 예상되지만 국민의 압도적 다수가 특검을 바라고 있기에 주권자 뜻에 따라 특검이 반드시 실현되도록 최선을 다하겠다 고 ,1,1
278,이재명 검찰 권한 남용 범죄 은폐로 나라 어지럽혀 ,이 대표의 발언은 검찰이 김건희 여사의 각종 의혹을 수사하는 데 소극적이라는 점을 언급하며 김건희 여사 특검법 의 필요성을 강조한 것으로 풀이됩니다 이 대표는 국민이 이 나라의 법 질서 회복을 바란다 며 특검은 ,0,1
279,이재명 검 권한남용 범죄 은폐로 나라 어지럽혀 특검 통과돼야 ,법 절차와 법 질서를 지키는 것이 당연하다 며 이같이 밝혔습니다 이 대표의 발언은 검찰이 김건희 여사의 각종 의혹을 수사하는 데 소극적이라는 점을 언급하며 김건희 여사 특검법 의 필요성을 강조한 것으로 풀이됩니다 ,0,0
280,김민석 이재명 선고에 감정 실린 판결 모두의 상상 뛰어넘어 ,민주당은 선고 다음 날인 일 김건희 윤석열 국정농단 규탄 특검 촉구 제 차 국민 행동의 날 장외 집회를 이 대표는 어느 순간부터 이 나라의 주인은 윤석열 김건희 명태 균 등으로 바뀐 것 아닌가 하는 생각이 든다 ,1,1
281,이재명 김건희 여사 특검법 거부권 행사 예상되지만 나라는 대통령 ,이 대표의 발언은 검찰이 김건희 여사의 각종 의혹을 수사하는 데 소극적이라는 점을 언급하며 김건희 여사 특검법 의 필요성을 강조한 것으로 풀이된다 이 대표는 국민이 이 나라의 법 질서 회복을 바란다 며 특검은 ,1,0
282,검찰 명태균 의혹 에 이준석 집중 김소연 과 비율은 대 정도 , 사진 연합뉴스 검찰이 정치 브로커 명태균씨를 둘러싼 각종 의혹의 핵심으로 윤석열 대통령과 김건희 아울러 김 변호사는 명씨가 함 교수 김건희 여사 조은희 전 서초구청장 현 국민의힘 의원 과 년 월 중순 ,1,1
283,최민희 급기야 정치적 공개 살인예고 비명계 움직이면 죽이겠다 , 일 정치권에 따르면 최민희 민주당 의원은 지난 일 서울 도심에서 열린 이재명 방탄 논란이 있는 김건희 윤석열 국정농단 규탄 관련 집회 현장에서 가진 유튜브와의 인터뷰에서 일부 언론의 흔들기에 부화뇌동해 ,0,0
284,위기의 이재명 특검 총공세 범죄 은폐로 나라 어지럽혀 ,이 대표의 발언은 검찰이 이 대표 자신을 향한 수사에는 적극적으로 나서면서 김건희 여사의 각종 의혹을 수사하는 데 소극적이다는 뜻으로 풀이된다 이 대표는 그러면서 특검이 반드시 통과돼야 한다 고 말했다 ,0,1
285,이재명 본인 재판 언급 없이 김건희 특검법 반드시 통과돼야 ,김경민 한병찬 기자 이재명 더불어민주당 대표는 일 이번 김건희 특검은 반드시 통과돼야 한다 고 또 김건희 특검법에 대해 대통령의 거부권 행사가 예상된다 며 이 나라는 대통령 혼자의 것이 아니다 국민의 ,1,1
286,박찬대 이재명 심 최악의 판결 명백한 사법살인 ,박 원내대표는 제 야당 대표와 배우자가 년 넘게 수사와 재판을 받고 있는데 왜 김건희 여사에 대한 수사는 제대로 이뤄지지 않고 심지어 기소조차 되지 않았는가 라고 반문했다 그는 식사비 만 원 때문에 ,0,0
287,이재명 국가 질서 어지럽혀 이번 특검 반드시 통과돼야 ,이상섭 기자 헤럴드경제 박상현 김해솔 기자 이재명 더불어민주당 대표는 일 김건희 여사 특검법과 관련 이 대표는 선고 다음 날인 지난 일 서울 광화문 앞에서 열린 김건희 윤석열 국정농단 규탄 및 특검 촉구 ,1,1
